{
    "$schema": "http://json-schema.org/draft-07/schema#",
    "title": "Team Configuration",
    "type": "object",
    "required": ["provider", "config"],
    "properties": {
        "provider": {"type": "string"},
        "component_type": {"type": "string"},
        "version": {"type": "number"},
        "component_version": {"type": "number"},
        "description": {"type": "string"},
        "label": {"type": "string"},
        "responsibilities": {"type": "array", "items": {"type": "string"}},
        "config": {
            "type": "object",
            "required": ["participants"],
            "properties": {
                "participants": {
                    "type": "array",
                    "minItems": 1,
                    "items": {
                        "type": "object",
                        "required": ["config"],
                        "properties": {
                            "provider": {"type": "string"},
                            "component_type": {"type": "string"},
                            "config": {
                                "type": "object",
                                "required": ["name"],
                                "properties": {
                                    "name": {"type": "string"},
                                    "prompt_path": {"type": "string"}
                                }
                            }
                        }
                    }
                },
                "tools": {"type": "array", "items": {"type": "object"}}
            }
        }
    }
}
